7725074710579,White Color Organza Saree With Multi Color Floral Print Over Body,Kalyan Silks,2375.00,0,Saree,General,Women,White,Design Details Celebrate vibrant style with this white organza saree adorned with colorful floral prints all over the body. The sheer fabric and lively design make it an excellent choice for daytime functions and festive events. The saree comes with an unstitched blouse piece The blouse worn by the model might be for modelling purpose only. Check the image of the blouse piece to understand how the actual blouse piece looks like. Size & Fit Length: 5.5 metres plus 0.8 metre blouse piece Width: 1.,,Default Title,7725074710579_thumb.jpg,,7725074710579_1.jpg; 7725074710579_2.jpg; 7725074710579_3.jpg; 7725074710579_4.jpg; 7725074710579_5.jpg; 7725074710579_6.jpg; 7725074710579_7.jpg; 7725074710579_8.jpg; 7725074710579_9.jpg,null
7725073465395,Blue Ash Color Tissue Net Saree With Mini Stones Over Body,Kalyan Silks,1905.00,0,Saree,General,Women,Blue,"Design Details Make a statement with this blue ash tissue net saree featuring subtle mini stone embellishments over the body. Lightweight and stylish, it drapes beautifully, offering an elegant look for festive and formal occasions. The saree comes with an unstitched blouse piece The blouse worn by the model might be for modelling purpose only. Check the image of the blouse piece to understand how the actual blouse piece looks like. Size & Fit Length: 5.5 metres plus 0.8 metre blouse piece Width",,Default Title,7725073465395_thumb.jpg,,7725073465395_1.jpg; 7725073465395_2.jpg; 7725073465395_3.jpg; 7725073465395_4.jpg; 7725073465395_5.jpg; 7725073465395_6.jpg; 7725073465395_7.jpg; 7725073465395_8.jpg; 7725073465395_9.jpg,null
7725059473459,Yellow Color Organza Saree With Floral Embroidery Design,Kalyan Silks,4435.00,0,Saree,General,Women,Yellow,Design Details Yellow and pink saree Floral embroidered saree with embroidered border border Has embroidered detail The saree comes with an unstitched blouse piece The blouse worn by the model might be for modelling purpose only. Check the image of the blouse piece to understand how the actual blouse piece looks like. Size & Fit Length: 5.5 metres plus 0.8 metre blouse piece Width: 1.06 metres (approx.) Material & Care Dry Clean Specifications Print or Pattern Type Floral Occasion Festive Orname,,Default Title,7725059473459_thumb.jpg,,7725059473459_1.jpg; 7725059473459_2.jpg; 7725059473459_3.jpg; 7725059473459_4.jpg; 7725059473459_5.jpg; 7725059473459_6.jpg; 7725059473459_7.jpg; 7725059473459_8.jpg; 7725059473459_9.jpg,null
7725059047475,Pista Green Color Crushed Organza Saree With White Sugar Beads & Tube Beads Worked Border,Kalyan Silks,2495.00,0,Saree,General,Women,Green,Design Details Green and white saree Embellished saree with embellished border border Has beads and stones detail The saree comes with an unstitched blouse piece The blouse worn by the model might be for modelling purpose only. Check the image of the blouse piece to understand how the actual blouse piece looks like. Size & Fit Length: 5.5 metres plus 0.8 metre blouse piece Width: 1.06 metres (approx.) Material & Care Dry Clean Specifications Print or Pattern Type Embellished Occasion Festive Orn,,Default Title,7725059047475_thumb.jpg,,7725059047475_1.jpg; 7725059047475_2.jpg; 7725059047475_3.jpg; 7725059047475_4.jpg; 7725059047475_5.jpg; 7725059047475_6.jpg; 7725059047475_7.jpg; 7725059047475_8.jpg; 7725059047475_9.jpg,null
7725058031667,Army Green Color Georgette Saree With Silver Embroidery & Stones On Body,Kalyan Silks,2540.00,0,Saree,General,Women,Green,,,Default Title,7725058031667_thumb.jpg,,7725058031667_1.jpg; 7725058031667_2.jpg; 7725058031667_3.jpg; 7725058031667_4.jpg; 7725058031667_5.jpg; 7725058031667_6.jpg; 7725058031667_7.jpg; 7725058031667_8.jpg; 7725058031667_9.jpg,null
7725057933363,Black Color Georgette Saree With Golden Stripe Embroidery Design On Body,Kalyan Silks,1675.00,0,Saree,General,Women,Black,,,Default Title,7725057933363_thumb.jpg,,7725057933363_1.jpg; 7725057933363_2.jpg; 7725057933363_3.jpg; 7725057933363_4.jpg; 7725057933363_5.jpg; 7725057933363_6.jpg; 7725057933363_7.jpg; 7725057933363_8.jpg; 7725057933363_9.jpg,null
7725057703987,Bottle Green Color Organza Saree With Golden Small Buttas & Mini Stone Works,Kalyan Silks,1710.00,0,Saree,General,Women,Green,,,Default Title,7725057703987_thumb.jpg,,7725057703987_1.jpg; 7725057703987_2.jpg; 7725057703987_3.jpg; 7725057703987_4.jpg; 7725057703987_5.jpg; 7725057703987_6.jpg; 7725057703987_7.jpg; 7725057703987_8.jpg,null
7725057605683,Dark Purple Net Saree With Embroidery And Sequence Work,Kalyan Silks,950.00,0,Saree,General,Women,Purple,,,Default Title,7725057605683_thumb.jpg,,7725057605683_1.jpg; 7725057605683_2.jpg; 7725057605683_3.jpg; 7725057605683_4.jpg; 7725057605683_5.jpg; 7725057605683_6.jpg; 7725057605683_7.jpg; 7725057605683_8.jpg,null
